Reihenfolge;Soft Cluster;Topic;Q HR ID;Fragetext;Argument;leftpositiv;onesided;onlynegaiv;Low Bound;High Bound;InfoText
17;e;Staat;Markt;Der Arbeitsmarkt regelt Angebot und Nachfrage nach Arbeit. Mit dem Grundeinkommen gibt es mehr Entscheidungsfreiheit, nicht an diesem Markt teilzunehmen. Kommt das gut? ;;x;;;Ja;Nein ;"Wenn man sich eine Welt mit bedingungslosem Grundeinkommen denkt, muss
man sich fragen: Würde noch genug und **das Richtige produziert**
werden, um unsere Bedürfnisse zu befriedigen? Dabei ist es wichtig, dass
genug Menschen arbeiten. Und dass diese etwas herstellen, was auch
wirklich nachgefragt wird.

Heute müssen die meisten Menschen ihre Arbeit für Geld verkaufen. Dies
tun sie im Rahmen der Märkte. Durch die Marktmechanismen entstehen die
Preise für eine Arbeit. Wenn niemand bereit ist, für eine Arbeit, sei es
in Form einer Dienstleistung oder eines Produktes, zu bezahlen, dann
wird diese nicht ausgeführt. Nach diesem Angebot-Nachfrage-Prinzip
entscheidet sich, was gearbeitet wird und was nicht.

Zudem gibt es auch Güter, die auf einem unregulierten Markt nicht
bezahlbar wären – zum Beipsiel Kultur, Bildung, Stromversorgung. Dies
wird dann über staatliche Töpfe finanziert. Da entscheidet nicht das
klassische Angebots-Nachfrage-Prizip darüber, ob ein Projekt realisiert
wird, sondern die Demokratie.

Durch das bedingungslose Grundeinkommen hätten die Meschen die Wahl,
nicht an diesem Markt teilzunehmen. Sie könnten ihr ganzes Leben lang
arbeiten, ohne für ihre Arbeit Geld zu verlangen – denn leben können sie
ja vom Grundeinkommen – und sind so **weder auf das Feedback des
Marktes, noch auf das der Demokratie angewiesen**.

Dazu drei möglich Haltungen:

-   Die herrschenden Bedingungen führen zu **schlechten
    Produktionsverhältnissen und absurden Produkten**. Darum ist es gut,
    wenn wir die Möglichkeit haben, nicht am Arbeitsmarkt teilzunehmen.

-   Dadurch, dass die Menschen nicht mehr am Arbeitsmarkt teilnehmen
    müssen, sondern können, **fällt eine grosse Verzerrung weg** und er
    wird besser funktionierten.

-   Es ist schlecht, wenn die Menschen nicht am Markt teilnehmen müssen.
    Sie werden zwar weiterhin arbeiten, es ist jedoch unmöglich für den
    einzelnen abzuschätzen, was jemand anderes braucht. Die Menschen
    werden **an den Bedürfnissen vorbei arbeiten**."
18;g;Staat;Revolution;Das bedingungslose Grundeinkommen verändert die Ausgangslage für Sozialstaat-Reformen. Es wird...;;x;;;Besser;Schlechter;"Diese Frage hat gar nicht nur mit der Idee des bedingungslosen
Grundeinkommens an und für sich zu tun. Sondern es geht darum, welche
anderen politischen Entwicklungen ausgelöst oder verhindert werden. Die
Debatte um den Sozialstaat ist festgefahren, die Fronten zwischen denen,
die mehr Sozialstaat fordern und denen, die diesen abbauen wollen, sind
verhärtet.

Die einen haben **Angst vor einem Abbau des Sozialstaates** durch die
Einführung des Grundeinkommens. Sie befürchten, dass mit einem Verweis
auf das existenzsichernde Grundeinkommen weitergehende
Unterstützungsleistungen gestrichen werden könnten und sich die
Situation von vielen vom Staat abhängiger Menschen verschlechtern würde.
Dies könnte Subeventionen für Krippenplätze betreffen oder auch einfach
nur jetzt noch kostenlose Beratungsleistungen der Sozialämter.

Andere lehnen das Grundeinkommen von Anfang an ab, weil sie in ihm vor
allem einen **massiven Ausbau des Sozialastaates sehen**.

Fakt ist, dass im Moment des Entscheides zur Einführung des
bedingungslosen Grundeinkommen gar nichts ab- oder ausgebaut wird. Wie
die sozialstaatlichen Einrichtungen in einer Schweiz mit Grundeinkommen
ausgestaltet sein werden, wird Gegenstand einer jahrelangen politischen
Diskussion sein und sehr wahrscheinlich wird auch der eine oder andere
Volksentscheid notwendig sein.
"
19;f;Gesellschaft;Alle;In einer arbeitsteiligen Gesellschaft gibt es keine Selbstversorger. Heute lebt keiner mehr direkt von den Früchten seiner Arbeit.  Passt das Grundeinkommen zu dieser Entwicklung?;;x;;;Ja;Nein ;"Viele Menschen glauben, dass sie unabhängig sind, weil sie mit dem
Lohnihrer Arbeit die notwendigen Dinge zum Leben kaufen können. Nun kann
man behaupten, dies sei eine Illusion.

Die Schweiz ist wohlhabend, weil die allgemeine **Arbeitsproduktivität**
hoch ist. Zentrales Element dafür ist die hohe **Arbeitsteilung**. Jede
und jeder macht in seiner Arbeit einen spezifischen Arbeitsschritt. Am
Ende sind an der Produktion einer Tomate Tausende indirekt beteiligt:
Die Mechanikerin, die den Traktor flickt. Der Programmierer der Software
für die Arbeitszeitenerfassung der Ölraffinerie in Saudiarabien, die das
Benzin für das Auto des Bauerns liefert. Die Kleinkindererzieherin, die
während der Ernte auf den Sohn der Bäuerin aufgepasst hat. Nun werden
diese alle auch am Erlös aus dem Verkauf der Tomate beteiligt. Was ist
aber mit dem Nachbarn, der kurzfristig eingesprungen ist, als die
Bäuerin ihre kranke Mutter besuchte? Und der Autor des Buches, das den
Bauer dazu inspirierte, Tomaten zu pflanzen? Und die Kinder im Dorf, die
so schön singen, dass die Mechanikerin für einmal all ihre Sorgen
vergessen kann und nicht in einer Depression versinkt, sodass sie
weiterhin Traktoren flicken kann?

Nun kann man argumentieren, dass alles mit allem zusammenhängt. Und alle
tragen etwas bei. Aber am Ende haben die einen ganz viel Geld auf ihrem
Konto und andere gar keines. Nur **unabhängig** ist bestimmt niemand. Es
ist in unserer komplexen Welt unmöglich, einen fairen oder richtigen
Verteilschlüssel für das Einkommen zu finden. Oder zu messen, wer
effektiv wie viel zu etwas beigetragen hat.

Das bedingungslose Grundeinkommen würde diesem Umstand teilweise gerecht
werden. Denn das Grundeinkommen macht den Teil des Einkommens, den man
unbedingt zum Leben braucht, bedingungslos.

Dagegen kann man einwenden, dass es sehr wohl ein Intrument gibt, das
misst, wer wie viel zu etwas beigetragen hat: Der **Markt** und das
**Geld**. Ein Arbeit ist genau so viel wert, wie jemand anders bereit
ist, dafür zu bezahlen. Es ist unbestreitbar, dass es Externalitäten
gibt: Das sind Auswirkungen, für die niemand bezahlt oder einen
Ausgleich erhält. Es stellte sich hier die Frage, wie diese
Externalitäten vermindert werden können, anstatt einfach Geld zu verteilen."
20;e;Staat;Schweiz;Soll die Schweiz eine Vorreiterrolle in der Welt einnehmen, indem sie unerprobte Wege geht?;;x;;;Ja;Nein ;"Zurzeit werden ähnliche Ideen wie das bedingungslose Grundeinkommen in
verschiedenen Ländern getestet. Finnlands Regierung arbeitet an einem
Versuch mit einem Grundeinkommen von 800 Euro. In Holland läuft ein
Experiment mit einer handvoll Probanden. Das bedingungslose
Grundeinkommen ist also durchaus ein Konzept, das aktuell internationale
Beachtung findet.

Es gibt immer wieder grosse Gesellschaftliche Veränderungen und irgendwo
werden diese Ideen zuerst umgesetzt. Das beste Beispiel ist vielleicht
die AHV: Es war Deutschland, das 1889 die damals neue und radikale Idee
einer flächendeckenden Rente einführte. Danach zogen die meisten
europäischen Staaten und die USA nach.

Man kann argumentieren, dass die Schweiz als reiches und demokratisches
Land in einer sehr guten Position ist, um fortschrittliche Ideen
umzusetzen und zu testen. Die Schweiz kann es sich leisten, mit
**internationalen Trends voranzugehen**.

Dagegen kann man sagen, dass sich das differenzierte und bedarfsgerechte
System der Sozialleistungen in der Schweiz bewährt hat. Wir sind so
wohlhabend und demokratisch, weil wir **Bewährtes nicht leichtfertig
aufgeben**. Eine Vorreiterrolle ist kein Wert für sich. Oder: Wir warten
noch ein bisschen bis eine radikalere und **bessere Idee** als das
Grundeinkommen auftaucht, um unsere Fortschrittlichkeit unter Beweis zu
Stellen."
21;d;Staat;Demokratie;Die Demokratie wird gestärkt, weil die Menschen mehr Zeit dafür haben.;;x;x;;Ja;Nein ;"Politisches Engagement braucht viel Zeit – vom gut informierten
Abstimmen über das Sammeln von Unterschriften bis hin zum Kandidieren
für ein Parlament. Um die politischen Pflichten und Rechte ernst zu
nehmen, braucht man Zeit. Ein bedingungsloses Grundeinkommen könnte zur
**Chancengleichheit in der Politik** beitragen. Heute gibt es Menschen,
die es sich leisten können, grössere politische Verantwortung zu
übernehmen und sich zum Beispiel in einer Partei einzubringen und
solche, die dies nicht können, weil sie von morgens bis abends Geld
verdienen müssen."
